{
  "$schema": "../../../schema/flow.schema.json",
  "id": "support-ticket",
  "order": 1,
  "name": "Обращение клиента в поддержку",
  "group": "service",
  "tone": "info",
  "entry": "Чат на сайте, письмо на support@, мессенджер",
  "what": "Клиент пишет в поддержку: CRM создаёт тикет и пробует ответить статьёй базы знаний. Если не помогло — тикет идёт первой линии, при необходимости второй. Тикет закрывается подтверждением клиента или автоматически через три дня тишины.",
  "root": "in.message",
  "strict": true,
  "stages": {
    "intake": "Приём обращения",
    "self": "Самообслуживание",
    "work": "Работа линий поддержки",
    "close": "Закрытие"
  },
  "steps": {
    "in.message": {
      "kind": "entry",
      "actor": "client",
      "stage": "intake",
      "title": "Клиент пишет в поддержку",
      "code": "омниканальный ящик CRM",
      "what": "Сообщение из любого канала попадает в единый ящик и привязывается к контакту по почте или телефону.",
      "next": "st.ticket"
    },
    "st.ticket": {
      "kind": "step",
      "actor": "crm",
      "stage": "intake",
      "title": "Создаём тикет и определяем тему",
      "code": "робот «Классификатор обращений»",
      "what": "Тема определяется по ключевым словам: оплата, доставка, доступ, ошибка. От темы зависит, какую статью базы знаний предложить.",
      "effects": ["тикет: статус «Новый», тема, канал", "клиенту — автоответ с номером тикета"],
      "next": "br.knowledge"
    },
    "br.knowledge": {
      "kind": "branch",
      "actor": "robot",
      "stage": "self",
      "title": "В базе знаний есть ответ?",
      "code": "поиск по базе знаний",
      "what": "Если для темы есть статья с высоким совпадением, клиенту сразу уходит ссылка на неё с вопросом «Это помогло?».",
      "branches": [
        { "short": "да", "hint": "статья найдена", "cond": "совпадение статьи ≥ 80%", "to": "br.helped", "tone": "ok" },
        { "short": "нет", "hint": "нужен человек", "cond": "подходящей статьи нет", "to": "st.queue", "tone": "info" }
      ]
    },
    "br.helped": {
      "kind": "branch",
      "actor": "client",
      "stage": "self",
      "title": "Статья решила вопрос клиента?",
      "code": "кнопки «Помогло / Не помогло»",
      "what": "Клиент отвечает кнопкой в письме или чате.",
      "branches": [
        { "short": "да", "hint": "клиент нажал «Помогло»", "cond": "ответ = «Помогло»", "to": "fin.selfService", "tone": "ok" },
        { "short": "нет", "hint": "нужен специалист", "cond": "ответ = «Не помогло» или ответа нет 1 час", "to": "st.queue", "tone": "warn" }
      ]
    },
    "st.queue": {
      "kind": "step",
      "actor": "robot",
      "stage": "work",
      "title": "Ставим тикет в очередь первой линии и запускаем SLA",
      "code": "робот «Маршрутизация»",
      "what": "Тикет получает приоритет по тарифу клиента и попадает в общую очередь первой линии. Таймер SLA: первый ответ за 4 рабочих часа.",
      "effects": ["тикет: статус «В очереди», приоритет по тарифу"],
      "spawns": ["sla.response"],
      "next": "br.firstLine"
    },
    "br.firstLine": {
      "kind": "branch",
      "actor": "support",
      "stage": "work",
      "title": "Первая линия решила сама?",
      "code": "тикет · кнопка «Эскалировать»",
      "what": "Первая линия закрывает типовые вопросы: доступы, счета, настройки. Ошибки продукта и доработки уходят второй линии.",
      "branches": [
        { "short": "да", "hint": "типовой вопрос", "cond": "специалист отправил решение", "to": "st.solution", "tone": "ok" },
        { "short": "нет", "hint": "нужна вторая линия", "cond": "нажата «Эскалировать»", "to": "st.escalate", "tone": "warn" }
      ]
    },
    "st.escalate": {
      "kind": "step",
      "actor": "support",
      "stage": "work",
      "title": "Передаём тикет второй линии",
      "code": "очередь «Вторая линия»",
      "what": "Вторая линия разбирает ошибку, при необходимости заводит задачу разработке и связывает её с тикетом.",
      "effects": ["тикет: статус «На второй линии»", "связанная задача в трекере разработки"],
      "next": "wait.fix"
    },
    "wait.fix": {
      "kind": "wait",
      "actor": "support",
      "stage": "work",
      "title": "Ждём: вторая линия или разработка готовит решение",
      "what": "Срок зависит от разработки. Клиенту раз в три дня уходит статус по задаче.",
      "attention": ["Таймер SLA на время ожидания разработки не останавливается: долгие исправления портят статистику первой линии, хотя она уже отработала."],
      "next": "st.solution"
    },
    "st.solution": {
      "kind": "step",
      "actor": "support",
      "stage": "close",
      "title": "Отправляем клиенту решение",
      "code": "ответ в тикете",
      "what": "Тикет переходит в «Ожидает подтверждения»: клиент должен ответить, решена ли проблема.",
      "effects": ["тикет: статус «Ожидает подтверждения»"],
      "next": "wait.confirm"
    },
    "wait.confirm": {
      "kind": "wait",
      "actor": "client",
      "stage": "close",
      "title": "Ждём подтверждения клиента три дня",
      "code": "робот «Автозакрытие»",
      "what": "Клиент может подтвердить решение, сказать, что проблема осталась, или промолчать.",
      "branches": [
        { "short": "решено", "hint": "клиент подтвердил", "cond": "клиент ответил «Решено»", "to": "fin.closed", "tone": "ok" },
        { "short": "не решено", "hint": "проблема осталась", "cond": "клиент ответил, что не помогло", "to": "st.queue", "tone": "warn" },
        { "short": "молчит", "hint": "три дня без ответа", "cond": "ответа нет 3 рабочих дня", "to": "fin.autoClosed", "tone": "info" }
      ]
    },
    "fin.selfService": { "kind": "terminal", "actor": "crm", "stage": "self", "outcome": "ok", "title": "Финиш: клиент справился по статье", "what": "Тикет закрыт без участия специалиста — самый дешёвый исход." },
    "fin.closed": { "kind": "terminal", "actor": "crm", "stage": "close", "outcome": "ok", "title": "Финиш: тикет закрыт, клиент доволен", "what": "Клиенту уходит опрос удовлетворённости (CSAT)." },
    "fin.autoClosed": { "kind": "terminal", "actor": "robot", "stage": "close", "outcome": "info", "title": "Финиш: тикет закрыт автоматически", "what": "Клиент не ответил три дня — тикет закрывается роботом.", "attention": ["При автозакрытии опрос CSAT не отправляется: оценки собираются только с тех, кто ответил, и средняя удовлетворённость завышена."] },
    "sla.response": {
      "kind": "branch",
      "actor": "robot",
      "title": "Первый ответ дан за 4 рабочих часа?",
      "code": "таймер SLA «Первый ответ»",
      "what": "Параллельная линия: таймер следит за первым публичным ответом специалиста в тикете.",
      "branches": [
        { "short": "да", "hint": "SLA соблюдён", "cond": "первый ответ за 4 рабочих часа", "to": "fin.slaOk", "tone": "ok" },
        { "short": "нет", "hint": "SLA нарушен", "cond": "4 часа прошло без ответа", "to": "st.slaAlert", "tone": "bad" }
      ]
    },
    "st.slaAlert": {
      "kind": "step",
      "actor": "lead",
      "title": "Сообщаем руководителю поддержки о просрочке",
      "code": "робот «Эскалация SLA»",
      "what": "Руководитель видит тикет в списке просроченных и может поднять приоритет или забрать себе.",
      "effects": ["уведомление руководителю поддержки", "метка «SLA нарушен» в тикете"],
      "next": "fin.slaBreach"
    },
    "fin.slaOk": { "kind": "terminal", "actor": "robot", "outcome": "info", "title": "Финиш: первый ответ вовремя", "what": "Время реакции уходит в отчёт по SLA." },
    "fin.slaBreach": { "kind": "terminal", "actor": "robot", "outcome": "warn", "title": "Финиш: SLA первого ответа нарушен", "what": "Нарушение попадает в отчёт по линии поддержки и в ежемесячный отчёт клиенту по тарифу." }
  },
  "presets": [
    { "name": "Хватило статьи из базы знаний", "tone": "ok", "note": "самый дешёвый исход, без специалиста", "path": ["in.message", "st.ticket", "br.knowledge", "br.helped", "fin.selfService"] },
    { "name": "Первая линия решила вопрос", "tone": "ok", "note": "основной путь для типовых вопросов", "path": ["in.message", "st.ticket", "br.knowledge", "st.queue", "br.firstLine", "st.solution", "wait.confirm", "fin.closed"], "sub": ["sla.response", "fin.slaOk"] },
    { "name": "Ошибка продукта через вторую линию", "tone": "warn", "note": "эскалация, ожидание исправления, просроченный SLA", "path": ["in.message", "st.ticket", "br.knowledge", "st.queue", "br.firstLine", "st.escalate", "wait.fix", "st.solution", "wait.confirm", "fin.closed"], "sub": ["sla.response", "st.slaAlert", "fin.slaBreach"] },
    { "name": "Решение не помогло — тикет переоткрыт", "tone": "warn", "note": "клиент возвращает тикет в очередь", "path": ["in.message", "st.ticket", "br.knowledge", "st.queue", "br.firstLine", "st.solution", "wait.confirm", "st.queue", "br.firstLine", "st.solution", "wait.confirm", "fin.closed"] },
    { "name": "Клиент пропал после ответа", "tone": "info", "note": "автозакрытие через три дня", "path": ["in.message", "st.ticket", "br.knowledge", "br.helped", "st.queue", "br.firstLine", "st.solution", "wait.confirm", "fin.autoClosed"] }
  ]
}
